French macaroon is so tasty,4
work is horrible,3
I am upset,8 
throw the ball,5 
Good joke,1
what is your favorite baseball game,9
I cooked meat,2
stop messing around,8
I want chinese food,2
Let us go play baseball,8
I am failing this exercise,3
yesterday we lost again,3 
Good job,2
ha ha ha it was so funny,2
I will have a cheese cake,2
Why are you feeling bad,9
I want to joke,1
I never said yes for this,3 
the party is cancelled,8 
where is the ball,9
I am frustrated,3 
ha ha ha lol,1
she said yes,2
he got a raise,2
family is all I have,0
he can pitch really well,5
I love you to the stars and back,0
do you like pizza ,9 
I deserve this prize,7
I miss you so much,0
I like your jacket ,6
she got me a present,0
will you be my valentine,0
I failed the midterm,3 
Who is down for a restaurant,9
valentine day is near,0
Great so awesome,2
do you have a notebook,9
he can not do anything,3
he always gives it all,5
We had such a lovely dinner tonight,4
vegetables are healthy,7
he is a good friend,0 
never talk to me again,8
i miss her,3 
food is life,4
I am having fun,2
So bad that you cannot come with us,3 
do you want to join me for dinner ,9
I like to smile,2 
he did an amazing job,2
Stop shouting at me,8
I love taking breaks,0
You are incredibly intelligent and talented,4
I am proud of your achievements,2
So sad you are not coming,3 
funny,1
Stop saying bullshit,8
Bravo for the announcement,2
This specialization is great,2
I was waiting for her for two hours ,3 
she takes forever to get ready,8
My grandmother is the love of my life,0 
I will celebrate soon,5
my code is working but the grader gave me zero,8
She is the cutest person I have ever seen,0
he is laughing,1
I adore my dogs,0
I love you mum,0 
great job,6
How dare you ask that,8
this guy was such a joke,2
I love indian people,4
Are you down for a gaming night,9
this is bad,3
Your stupidity has no limit,8
I love my dad,0
Do you want to give me a hug,4
this girl was mean,3
I am excited,2
i miss him,0
What is wrong with you,8
they are so kind and friendly,0
I am so impressed by your dedication to this project,7
we made it,2
I am ordering food,4
Sounds like a fun plan ha ha,1
I am so happy for you,2
Miss you so much,0
I love you,0
this joke is killing me ha ha,1
you are not qualified for this position,3
miss you my dear,0
I am eating,4
I am so excited to see you after so long,5
he is the best player,4
What a fun moment,1
my algorithm performs poorly,3
Stop shouting at me,8
her smile is so charming,4
It is the worst day in my life,3
he is handsome,0
no one likes me,3
she is attractive,4
It was funny lol,1
he is so cute,4
you did well on your exam,6
I think I will end up alone,3
Lets have food together,2
too bad that you were not here,3
I want to go play,5
I am a loser,3
I am starving,3
you suck,8
Congratulations,2
I could not solve it,3
I lost my wallet,3
she did not answer my text ,3
That catcher sucks ,8
See you at the restaurant,5
I said yes,6
candy is life ,4
okay,6
perfect,6
alright,6
congratulations on your acceptance,2
The assignment is too long ,3
lol,1
I got humiliated by my sister,8
the lectures are great though ,2
you did not do your homework,8
The baby is adorable,4
Bravo,2
I missed you,0
I am looking for a date,5
where is the food,9
I am awful,3
any suggestions for dinner,9
she is happy,2
I am always working,3
This is so funny,1
I got a down grade,3
I want to have sushi for dinner,5
she smiles a lot,2
The chicago cubs won again,4
I got approved,4
cookies are good,4
I hate him,8
I am going to the stadium,4
I am very disappointed,8
I am proud of you forever,2
This girl is messing with me,8
Congrats on the new job,2
enjoy your break,2
go away,8
I worked during my birthday,3
Congratulations for having a baby,2
I am hungry,3
She is my dearest love,0
she is so cute,4
I love dogs,4
I did not have breakfast ,3
my dog just had a few puppies,0
I like you a lot,4
are you serious ha ha,1
I like to laugh,1
Stop making this joke ha ha ha,1
you two are cute,4
This stupid grader is not working,8
What you did was awesome,7
My life is so boring,3
he did not answer,3
lets exercise,5
you brighten my day,2
I will go dance,5
lets brunch some day,2
dance with me,2
she is a bully,3
she is very good playing hockey,4
I like it when people smile,2
I hate you, 8
stop yelling at me,8
this is not funny anymore,8
why are you so mean,8
she is the most awful person I have ever met,8
i am angry,8
i will get angry,8
what is your name,9
where do you live,9
which are your hobbies,9
how is your boyfriend,9
how old are you,9
i am thinking about it,9
let me think,9
which is your favorite restaurant,9
which is your favorite artist,9
what series do you recommend to me,9
That sunset view got me like,0
I love you,0
Pretending to laugh at your boss's joke ,1
Oh my god so cringe right now,1
Bae's text got me feeling all,4
Oh my god so cute!,4
you are so beautiful,4
this cat is amazingly beautiful,4
when i saw you i just fell in love,4
how are you so pretty,4
i am loving this sunset,4
i appreciate what you are doing for me,7
this city is lovely,4
that guy is handsome,4
what a pretty dog,4
that charming man got me crazy,4
my boss is super nice-looking,4
i love you to the moon and back,0
Holding back tears but failing ,3
I missed my favorite TV show ,3
My friend has canceled the plan at the last minute,8
I cry,3
i am feeling the pain,3
i dont understand anything,3
so sad,3
that was painful,3
Mondays are the worst,3
I'm tiny,3
I don't get anything,3
Thumbs up for you,6
Thanks family for everything you do for me,7
Thanks god,7
I am praying for you,7
God is with us,7
I am going to the church,7
i will meditate this afternoon,7
come with me so we meditate together,7
thank you so much,7
i appreciate it,7
thanks for real,7
what you did for me is amazing,7
i will be always honored for this,7
The word of god is the only reality,7
pray,7
goodness,7
i hope it will be fine this time,7
please,7
please do it for me,7
I beg you,7
please i am asking you in a good way,7
eternally grateful,7
i am feeling grateful right now,7
I thank god for being alive,7
meditation is the seeking for peaceful,7
praying for it to go well,7
pray,7
pray with me,7
i recommend you to pray every night,7
grateful with you,7
begging for help,7
i hope it will gone the way you want,7
praying for you my brother,7
being a chaplain is my objective,7
I am upset with you,8
you were so mean that night,8
i will get angry,8
dont provoke me,8
we will end up being enemies,8
dont play with me,8
be clear with what you want,8
dont judge me anymore,8
shut up,8
that was enough stop,8
Contemplating life's mysteries,9
Lost in thought,9
what do you mean,9
i dont get it,9
Sending you some love.,0
I can't wait to see you tonight,0
You're the best,0
Just wanted to send some love your way,0
Missing you like crazy,0
Thinking of you always,0
It is impossible to love you more,0
Just dropping in to say I love you,0
Feeling grateful for you every day,0
Life is better with you in it,0
Thanks for being my life mate,0
Couldn't imagine my life without you,0
You make my heart happy,0
Love you more than words can say,0
Forever grateful for your love,0
Haha that was hilarious,1
Can't stop laughing,1
You crack me up every time,1
OMG I'm dying,1
That meme got me good,1
LMAO,1
Stop, I can't breathe,1
This is too funny,1
LOL,1
I'm in tears,1
You're killing me with these jokes,1
ROFL,1
Literally can't stop laughing,1
I'm crying from laughing so hard,1
That's comedy gold,1
HAHAHAHA,1
This is too much,1
My stomach hurts from laughing,1
This meme is everything,1
You're a riot,1
Can't handle the humor,1
My cheeks hurt from smiling,1
That's the funniest thing I've heard all day,1
Pure comedy genius,1
You always make me smile,2
I am so happy when you are around,2
Your happiness is infectious,2
I am feeling much more good now,2
The presentation went super good,2
I have passed the exam,2
We are happy together,2
Thinking of you fills me with joy,4
Your kindness warms my heart,4
You're the light in my day,4
Every moment with you is special,4
Your presence makes me feel better,4
You're on fire, keep it up,5
This party is amazing,5
That performance was fire,5
Let's make tonight unforgettable,5
You're blazing through this,5
Feeling the heat,5
The energy here is fire,5
Keep shining bright,5
That outfit is fire,5
We're gonna set the night on fire,5
You're sparking inspiration,5
The music is fire tonight,5
Let's ignite some fun,5
Feeling the warmth of your friendship,5
You're burning with passion,5
The atmosphere is electric,5
This place is fire,5
Your talent is like wildfire,5
You're bringing the heat,5
Let's light up the dance floor,5
Burning with excitement,5
The dance floor is heating up,5
Feeling the burn in the best way,5
This workout is fire,5
Heating things up,5
Let's ignite some fun,5
I am excited with it,5
We are super excited for it,5
The excitement is real,5
I get it,6
Great,6
Superb,6
good job,6
well done,6
well done man,6
your part of the project is perfect,6
nice,6
nice project,6
nice report guys,6
I have already received it guys,6
everything is fine,6
its okay for me,6
sounds good to me,6
perfect for the moment,6
everything okay,6
ok,6
everything ok,6
i am ok,6
the ball is okay,6
good,6
should work,6
yes,6
yes i will be there,6
fine,6
perfect,6
It is the same i did,6
so did I,6
keep going like this,6
checked,6
i have checked it and it is fine,6
good option yeah,6
Hmm, I wonder if pizza is technically a vegetable,9
you know it,9
can you help me with my homework,9
where do i left my keys,9
Have I told you this story,9
are you daydreaming,9
are you overthinking,9
what do you think about this possibility,9
mhhh i dont know it to be honest,9
got me thinking now,9
i was wondering if you like potatoes,9
I am mentally chewing on this now,9
Interesting concept, let me process,9
Let me dive into the depths of my mind for this,9
I'm in thinking mode now,9
do you think so,9